{
  "schema_version": "2.0.0",
  "command_id": "018f1e2d-3c4b-7a05-8c9d-001122334459",
  "tenant_id": "018f1e2d-3c4b-7a01-8c9d-001122334455",
  "workflow_type": "post_call_followup",
  "workflow_version": "1.0.0",
  "aggregate_type": "session",
  "aggregate_id": "018f1e2d-3c4b-7a02-8c9d-001122334456",
  "input_json": "{\"session_id\":\"example\"}",
  "idempotency_key": "post-call-followup-session-example",
  "requested_by": "018f1e2d-3c4b-7a03-8c9d-001122334457",
  "scheduled_at": "2026-07-14T20:05:00Z",
  "created_at": "2026-07-14T20:00:00Z"
}
